{
  "trust_snapshot": {
    "snapshot_id": "fixtures-2026-09-01",
    "sequence": 7,
    "issued_at": "2026-09-01T00:00:00Z",
    "expires_at": "2026-09-01T00:10:00Z",
    "max_clock_skew_seconds": 30,
    "max_lifetime_seconds": 600,
    "max_chain_depth": 2,
    "replay_policy": "online-required",
    "issuer_authorities": [
      {
        "principal": {
          "type": "service",
          "id": "example.invalid:issuer"
        },
        "key_id": "urn:agent-proof:kid:v1:sha256:zpKUp4Ns0gjst0W1WXiGvu3ksRnht-K5AlCA7d6aG3s",
        "public_jwk": {
          "kty": "OKP",
          "crv": "Ed25519",
          "x": "Zl0_RAzchmyrIJD9fP-fQE1wTgkLSAcP3WnLFRlMz6o"
        }
      }
    ],
    "status_publishers": [
      {
        "principal": {
          "type": "service",
          "id": "example.invalid:status"
        },
        "key_id": "urn:agent-proof:kid:v1:sha256:KNqDbVK6ecEfcoTArNoVdr7ddLPwInIrnNar2qSGZMc",
        "public_jwk": {
          "crv": "Ed25519",
          "kty": "OKP",
          "x": "uElDERzNl2gpbtGUBGiQGu-qNyzmB_hl1KpY3Ezdz9A"
        }
      }
    ],
    "roots": [
      {
        "issuer": {
          "type": "service",
          "id": "example.invalid:issuer"
        },
        "root_subject": {
          "type": "agent",
          "id": {
            "scheme": "agid",
            "version": 1,
            "authority": "example.invalid",
            "path": [
              "finance",
              "controller"
            ]
          }
        },
        "credential_purpose": "agent-root-authority"
      }
    ],
    "status_high_water": [
      {
        "publisher": {
          "type": "service",
          "id": "example.invalid:status"
        },
        "target_key_id": "urn:agent-proof:kid:v1:sha256:ZBX6j1I82CWRmCIG2Czu3Uvr5Ju33qrnRqU7Zwm5OOs",
        "sequence": 1,
        "semantic_digest": "sha256:3KJAutgBV49E0zFwCWQWRJPT8jPsM45cJefDvnxXJIc"
      },
      {
        "publisher": {
          "type": "service",
          "id": "example.invalid:status"
        },
        "target_key_id": "urn:agent-proof:kid:v1:sha256:0pBS3cvjY4ZCl5OMOtrljzWPrabu4Q2t6b-8ktM0rJo",
        "sequence": 1,
        "semantic_digest": "sha256:YLBGdX21j2ksBi0fHv5ZkQrMh84WTk5rbCGuYLBlRhI"
      },
      {
        "publisher": {
          "type": "service",
          "id": "example.invalid:status"
        },
        "target_key_id": "urn:agent-proof:kid:v1:sha256:7Yh1s0sOnypNb5ITJHl1sboprWN4n177p9Q_MbaoDao",
        "sequence": 1,
        "semantic_digest": "sha256:difDo6BcIR_YVhQ3g5TP1VMNZzvawQ5Cc_6XvItNbXQ"
      },
      {
        "publisher": {
          "type": "service",
          "id": "example.invalid:status"
        },
        "target_key_id": "urn:agent-proof:kid:v1:sha256:7zKNBd4LErGrX_5v0Z5NaYpLWnKeHkhJulJQ8ThUppE",
        "sequence": 1,
        "semantic_digest": "sha256:115oL5aKggQ6z23sEYUnrRrgxTj9udwQnqcgx5hmBLw"
      }
    ],
    "archival_policy": {
      "historical_verification": "explicit-snapshot-only",
      "minimum_retention_seconds": 86400
    },
    "policy_hash": "urn:agent-proof:policy:v1:sha256:1bj76j1jFW_i0OVz-xiC98whHMbxI1XTHDvJXrKY4sc"
  },
  "artifacts": [
    {
      "version": "agent-proof/v1",
      "kind": "credential",
      "issued_at": "2026-09-01T00:00:00Z",
      "issuer": {
        "type": "service",
        "id": "example.invalid:issuer"
      },
      "subject": {
        "type": "agent",
        "id": {
          "scheme": "agid",
          "version": 1,
          "authority": "example.invalid",
          "path": [
            "finance",
            "controller"
          ]
        }
      },
      "public_jwk": {
        "crv": "Ed25519",
        "kty": "OKP",
        "x": "FLDtGkAFE58koV25pt2k1OrH5zfskeX-Q5mx_G7NCcA"
      },
      "key_id": "urn:agent-proof:kid:v1:sha256:0pBS3cvjY4ZCl5OMOtrljzWPrabu4Q2t6b-8ktM0rJo",
      "not_before": "2026-09-01T00:00:00Z",
      "expires_at": "2026-09-01T00:10:00Z",
      "credential_purpose": "agent-root-authority",
      "authority_ceiling": {
        "capabilities": [
          "invoice.read",
          "invoice.submit"
        ],
        "resources": [
          {
            "type": "uri",
            "value": "https://api.example.invalid/v1/finance/invoices/2026-09"
          }
        ],
        "tasks": [
          "0198e1f8-0000-7000-8000-000000000001"
        ],
        "audiences": [
          "api.example.invalid"
        ],
        "not_before": "2026-09-01T00:00:00Z",
        "expires_at": "2026-09-01T00:10:00Z",
        "remaining_depth": 2
      },
      "id": "urn:agent-proof:v1:sha256:fDvTh7ci4JCAhZaMJFg1dFDB7tK2JCmFH9BSn2M84lk",
      "proof": {
        "alg": "Ed25519",
        "kid": "urn:agent-proof:kid:v1:sha256:ZBX6j1I82CWRmCIG2Czu3Uvr5Ju33qrnRqU7Zwm5OOs",
        "sig": "fymrGL8iw_guH-6XgxsSpxTz1qzlnPqIVeS_8ZuP8uPRN4Ckt-LaCiYJZmRqGuwl7IH829MVYXIPTdXIidNAAA"
      }
    },
    {
      "version": "agent-proof/v1",
      "kind": "credential",
      "issued_at": "2026-09-01T00:00:00Z",
      "issuer": {
        "type": "service",
        "id": "example.invalid:issuer"
      },
      "subject": {
        "type": "agent",
        "id": {
          "scheme": "agid",
          "version": 1,
          "authority": "example.invalid",
          "path": [
            "finance",
            "delegate"
          ]
        }
      },
      "public_jwk": {
        "crv": "Ed25519",
        "kty": "OKP",
        "x": "VwD3hXjf5ugsN0H5qBltTqH5-fkAz47f4nMAsUZ_CVY"
      },
      "key_id": "urn:agent-proof:kid:v1:sha256:7Yh1s0sOnypNb5ITJHl1sboprWN4n177p9Q_MbaoDao",
      "not_before": "2026-09-01T00:00:00Z",
      "expires_at": "2026-09-01T00:10:00Z",
      "credential_purpose": "agent-key-binding",
      "authority_ceiling": {
        "capabilities": [
          "invoice.read",
          "invoice.submit"
        ],
        "resources": [
          {
            "type": "uri",
            "value": "https://api.example.invalid/v1/finance/invoices/2026-09"
          }
        ],
        "tasks": [
          "0198e1f8-0000-7000-8000-000000000001"
        ],
        "audiences": [
          "api.example.invalid"
        ],
        "not_before": "2026-09-01T00:00:00Z",
        "expires_at": "2026-09-01T00:10:00Z",
        "remaining_depth": 1
      },
      "id": "urn:agent-proof:v1:sha256:fo-3ir3ir9rMJPKuScRfLV8MHLth6231ewfJrkm0Kkw",
      "proof": {
        "alg": "Ed25519",
        "kid": "urn:agent-proof:kid:v1:sha256:ZBX6j1I82CWRmCIG2Czu3Uvr5Ju33qrnRqU7Zwm5OOs",
        "sig": "X9edTuEatwa6JiBzrdAizveKrwIP3hdJprOAkdEt_zN6YywsLxdx57IqKWYTP4LYo2d9cuV9m37aC85be3XIBA"
      }
    },
    {
      "version": "agent-proof/v1",
      "kind": "credential",
      "issued_at": "2026-09-01T00:00:00Z",
      "issuer": {
        "type": "service",
        "id": "example.invalid:issuer"
      },
      "subject": {
        "type": "agent",
        "id": {
          "scheme": "agid",
          "version": 1,
          "authority": "example.invalid",
          "path": [
            "finance",
            "worker"
          ]
        }
      },
      "public_jwk": {
        "crv": "Ed25519",
        "kty": "OKP",
        "x": "EQWmxioajDr8PwOiembZ8hnBYiqZjxvqCQZlIPjWS1k"
      },
      "key_id": "urn:agent-proof:kid:v1:sha256:7zKNBd4LErGrX_5v0Z5NaYpLWnKeHkhJulJQ8ThUppE",
      "not_before": "2026-09-01T00:00:00Z",
      "expires_at": "2026-09-01T00:10:00Z",
      "credential_purpose": "agent-key-binding",
      "authority_ceiling": {
        "capabilities": [
          "invoice.read"
        ],
        "resources": [
          {
            "type": "uri",
            "value": "https://api.example.invalid/v1/finance/invoices/2026-09"
          }
        ],
        "tasks": [
          "0198e1f8-0000-7000-8000-000000000001"
        ],
        "audiences": [
          "api.example.invalid"
        ],
        "not_before": "2026-09-01T00:00:00Z",
        "expires_at": "2026-09-01T00:03:00Z",
        "remaining_depth": 0
      },
      "id": "urn:agent-proof:v1:sha256:sT0r4BxcS2ela8JLk_v8lNj-6-OmTItLGZDU8-8oHF8",
      "proof": {
        "alg": "Ed25519",
        "kid": "urn:agent-proof:kid:v1:sha256:ZBX6j1I82CWRmCIG2Czu3Uvr5Ju33qrnRqU7Zwm5OOs",
        "sig": "Om-t8jI73JEzlktkbXakEa8FdnC7ERivZ-Te4lnwcHJE8dTCzwXLm79TZsrGBBqckfz8bxYL3GwLPg9LMMNeCQ"
      }
    },
    {
      "version": "agent-proof/v1",
      "kind": "delegation",
      "issued_at": "2026-09-01T00:01:00Z",
      "delegator": {
        "type": "agent",
        "id": {
          "scheme": "agid",
          "version": 1,
          "authority": "example.invalid",
          "path": [
            "finance",
            "controller"
          ]
        }
      },
      "delegate": {
        "type": "agent",
        "id": {
          "scheme": "agid",
          "version": 1,
          "authority": "example.invalid",
          "path": [
            "finance",
            "delegate"
          ]
        }
      },
      "parent_ref": {
        "id": "urn:agent-proof:v1:sha256:fDvTh7ci4JCAhZaMJFg1dFDB7tK2JCmFH9BSn2M84lk",
        "kind": "credential"
      },
      "constraints": {
        "capabilities": [
          "invoice.read",
          "invoice.submit"
        ],
        "resources": [
          {
            "type": "uri",
            "value": "https://api.example.invalid/v1/finance/invoices/2026-09"
          }
        ],
        "tasks": [
          "0198e1f8-0000-7000-8000-000000000001"
        ],
        "audiences": [
          "api.example.invalid"
        ],
        "not_before": "2026-09-01T00:00:00Z",
        "expires_at": "2026-09-01T00:10:00Z",
        "remaining_depth": 1
      },
      "id": "urn:agent-proof:v1:sha256:lnD2Xf6M3gqRVTViMZrdFklq-lNm-XbYJOnnPDufIa8",
      "proof": {
        "alg": "Ed25519",
        "kid": "urn:agent-proof:kid:v1:sha256:0pBS3cvjY4ZCl5OMOtrljzWPrabu4Q2t6b-8ktM0rJo",
        "sig": "wUccJUr4NWipRTtCjXNfiq_-BqdtiFjjfgWnTqYyJI4MeeV21gcjYgHCqUcurGMwM4-DapQcxKeI3g7MJCudCA"
      }
    },
    {
      "version": "agent-proof/v1",